name,ticker,cik,cusip,exchange,isDelisted,category,sector,industry,sic,sicSector,sicIndustry,famaSector,famaIndustry,currency,location,id
FT VEST US EQUITY DEEP BUFFER ETF - NOVEMBER,DNOV,1667919,33740F839,BATS,False,ETF,,,,,,,,USD,Illinois; U.S.A,290f5cdd0d3bc4c5a598cf9860666f82
FT VEST US EQUITY DEEP BUFFER ETF - OCTOBER,DOCT,1667919,33740F672,BATS,False,ETF,,,,,,,,USD,Illinois; U.S.A,1867471e4b56d5e1e3fa8193664a75ca
APTUS DEFINED RISK ETF,DRSK,1540305,26922A388,BATS,False,ETF,,,,,,,,USD,Wisconsin; U.S.A,cd2b976a74d3a5f28706ac96607e80c2
DISCIPLINE FUND ETF,DSCF,1592900,02072L748,BATS,False,ETF,,,,,,,,USD,Pennsylvania; U.S.A,8060116531ceda86a0416e8b53c082f2
FT VEST US EQUITY DEEP BUFFER ETF - SEPTEMBER,DSEP,1667919,33740F680,BATS,False,ETF,,,,,,,,USD,Illinois; U.S.A,e36f270681bb55874e8a5f7d5e3c3942
INNOVATOR DOUBLE STACKER ETF - JANUARY,DSJA,1415726,45782C177,BATS,True,ETF,,,,,,,,USD,Illinois; U.S.A,9f629c0199257ab355aaa7df86b1b5b9
INNOVATOR DOUBLE STACKER ETF - OCTOBER,DSOC,1415726,45782C185,BATS,True,ETF,,,,,,,,USD,Illinois; U.S.A,28be3393d00d1b2b5cc83e0379b0cc7a
IPATH US TREASURY 2-YEAR BULL ETN,DTUL,,06740L469,BATS,True,ETN,,,,,,,,USD,,87ff9fad4936ff5eb78bc6e98431fda6
IPATH US TREASURY 2-YEAR BEAR ETN,DTUS,,06740L519,BATS,True,ETN,,,,,,,,USD,,62e4ad02f891bb1a787aeb030bd4928e
IPATH US TREASURY 10 YEAR BULL ETN,DTYL,,06740L493,BATS,True,ETN,,,,,,,,USD,,46aae0b1cacb786e0c72cfa4beedceb1
IPATH US TREASURY 10-YEAR BEAR ETN,DTYS,,06740L451,BATS,True,ETN,,,,,,,,USD,,24973466e1b04774132401c495beaa18
APTUS LARGE CAP ENHANCED YIELD ETF,DUBS,1540305,26922B535,BATS,False,ETF,,,,,,,,USD,Wisconsin; U.S.A,cd3947e87e15eaf224747a5d512f2da8
MERLYNAI SECTORSURFER MOMENTUM ETF,DUDE,1592900,02072L862,BATS,True,ETF,,,,,,,,USD,Pennsylvania; U.S.A,65eec0c04d6f09603b1ecd92782d7caf
VANECK DURABLE HIGH DIVIDEND ETF,DURA,1137360,92189H102,BATS,False,ETF,,,,,,,,USD,New York; U.S.A,32b9c6f60566d599d0a15d644982d79a
DAVIS SELECT US EQUITY ETF,DUSA,1670310,23908L207,BATS,False,ETF,,,,,,,,USD,Arizona; U.S.A,b1e2399e56300a8c5ef8a8abf177eae4
SOURCE DIVIDEND OPPORTUNITY ETF,DVOP,1683471,53656F839,BATS,True,ETF,,,,,,,,USD,Wisconsin; U.S.A,5a5de1e37b8c14c73982ddf794b0fa93
ARROW DWA TACTICAL: MACRO ETF,DWAT,1527428,042765792,BATS,False,ETF,,,,,,,,USD,Maryland; U.S.A,68ad7df6e5df1a10ac8adf363322cc60
ARROW DWA TACTICAL: INTERNATIONAL ETF,DWCR,1527428,042765685,BATS,False,ETF,,,,,,,,USD,,f321a4f893728c9a2e4541d24e4564bc
DAVIS SELECT WORLDWIDE ETF,DWLD,1670310,23908L306,BATS,False,ETF,,,,,,,,USD,Arizona; U.S.A,5949843b5b04b10aecac80f5baa11e64
WISDOMTREE DYNAMIC BEARISH US EQUITY FUND,DYB,1350487,97717X297,BATS,True,ETF,,,,,,,,USD,,43c72b34be47263ec2eb4f295bd0166a
WISDOMTREE DYNAMIC LONG/SHORT US EQUITY FUND,DYLS,1350487,97717X313,BATS,True,ETF,,,,,,,,USD,,602422f5bf49e0e807b264426a0b6120
INNOVATOR US EQUITY 5 TO 15 BUFFER ETF - QUARTERLY,EALT,1415726,45783Y475,BATS,False,ETF,,,,,,,,USD,Illinois; U.S.A,326713110d8fedbc3036590784421604
ISHARES ESG AWARE AGGRESSIVE ALLOCATION ETF,EAOA,1100663,46436E668,BATS,False,ETF,,,,,,,,USD,California; U.S.A,9b9c073f70669286d162126edaf047e8
ISHARES ESG AWARE CONSERVATIVE ALLOCATION ETF,EAOK,1100663,46436E692,BATS,False,ETF,,,,,,,,USD,California; U.S.A,b1a89dac46937e63584eea2b5addfe32
ISHARES ESG AWARE MODERATE ALLOCATION ETF,EAOM,1100663,46436E684,BATS,False,ETF,,,,,,,,USD,California; U.S.A,2728f943038ab0c292952449cfc78c19
ISHARES ESG AWARE GROWTH ALLOCATION ETF,EAOR,1100663,46436E676,BATS,False,ETF,,,,,,,,USD,California; U.S.A,dd12d0206ebcc7a3853cd2b00c107dcb
ISHARES MSCI CHILE ETF,ECH,930667,464286640,BATS,False,ETF,,,,,,,,USD,California; U.S.A,cd1d14f34b89c3fd44118c56bfed6b23
ISHARES MSCI DENMARK ETF,EDEN,1100663,46429B523,BATS,False,ETF,,,,,,,,USD,California; U.S.A,35fd4eb2cb7de841d27487e354082152
WISDOMTREE EUROPE DOMESTIC ECONOMY FUND,EDOM,1350487,97717X388,BATS,True,ETF,,,,,,,,USD,,203fca2910ce06b9385b5b100f99536a
ISHARES MSCI EMERGING MARKETS MIN VOL FACTOR ETF,EEMV,930667,464286533,BATS,False,ETF,,,,,,,,USD,California; U.S.A,dba5b7b9d5954f8e1895b1d78409c172
PROSHARES MSCI EAFE DIVIDEND GROWERS ETF,EFAD,1174610,74347B839,BATS,False,ETF,,,,,,,,USD,Maryland; U.S.A,6f4e2bbe385f54e25f27a847b8c60c64
ISHARES MSCI EAFE MIN VOL FACTOR ETF,EFAV,1100663,46429B689,BATS,False,ETF,,,,,,,,USD,California; U.S.A,08ebb232351164b24c638d1e69b84577
ISHARES MSCI EAFE GROWTH ETF,EFG,1100663,464288885,BATS,False,ETF,,,,,,,,USD,California; U.S.A,d70e62c7a6c960dd8b0a15fb8a8c92f5
ISHARES MSCI FINLAND ETF,EFNL,1100663,46429B515,BATS,False,ETF,,,,,,,,USD,California; U.S.A,d918d9fca6cbc7a2a231020fe68fce58
VANECK ETHEREUM STRATEGY ETF,EFUT,1137360,92189H698,BATS,False,ETF,,,,,,,,USD,New York; U.S.A,74419262ee1c10c09b82b7bf0c54bc5c
ISHARES MSCI EAFE VALUE ETF,EFV,1100663,464288877,BATS,False,ETF,,,,,,,,USD,California; U.S.A,60cfe010cef98f4b720d84140a4d910c
2NDVOTE SOCIETY DEFENDED ETF,EGIS,1811168,81386P306,BATS,True,ETF,,,,,,,,USD,Tennessee; U.S.A,2bd0c2457625655853b054e8dbfaa267
ISHARES ESG AWARE MSCI USA GROWTH ETF,EGUS,1100663,46436E239,BATS,False,ETF,,,,,,,,USD,California; U.S.A,84e63cfb225c4cb87ecea83c8e6a82eb
ELKHORN FTSE RAFI US EQUITY INCOME ETF,ELKU,1595106,287711204,BATS,True,ETF,,,,,,,,USD,,097c0e37eb96e565e65d5ff3f9c10607
EMERGE EMPWR SUSTAINABLE DIVIDEND EQUITY ETF,EMCA,1914404,29102W105,BATS,True,ETF,,,,,,,,USD,New York; U.S.A,ee3465eaa45eea677b1793b4e989df7b
EMERGE EMPWR SUSTAINABLE EMERGING MARKETS EQUITY ETF,EMCH,1914404,29102W402,BATS,True,ETF,,,,,,,,USD,New York; U.S.A,26fa4969bf0e2d26b57ad95ddd0e97f3
PROSHARES MSCI EMERGING MARKETS DIVIDEND GROWERS ETF,EMDV,1174610,74347B847,BATS,False,ETF,,,,,,,,USD,Maryland; U.S.A,4829db63f85de8a92cb3260e24a6318c
EMERGE EMPWR SUSTAINABLE SELECT GROWTH EQUITY ETF,EMGC,1914404,29102W204,BATS,True,ETF,,,,,,,,USD,New York; U.S.A,5e0a8c2bd4fa0401b1e05a6ac43c78f9
ISHARES EMERGING MARKETS EQUITY FACTOR ETF,EMGF,930667,46434G889,BATS,False,ETF,,,,,,,,USD,California; U.S.A,772cf7a7af4d1f8065ed507831bde6b0
ISHARES JP MORGAN EM HIGH YIELD BOND ETF,EMHY,930667,464286285,BATS,False,ETF,,,,,,,,USD,California; U.S.A,506f5888e6d3adbf921a7a965d0d6a3c
ISHARES MSCI EMERGING MARKETS HORIZON ETF,EMHZ,930667,46434G608,BATS,True,ETF,,,,,,,,USD,,115f838f282d98d0fedbbe370a0ac568
EMERGE EMPWR UNIFIED SUSTAINABLE EQUITY ETF,EMPW,1914404,29102W501,BATS,True,ETF,,,,,,,,USD,New York; U.S.A,86cc4738b5770c12b720316a9866dd63
WISDOMTREE STRONG DOLLAR EMERGING MARKETS EQUITY FUND,EMSD,1350487,97717X487,BATS,True,ETF,,,,,,,,USD,,f1aa67a195bbd9e9956973f51124b15d
PROSHARES SHORT TERM USD EMERGING MARKETS BOND ETF,EMSH,1174610,74347B706,BATS,True,ETF,,,,,,,,USD,Maryland; U.S.A,670518de5187e3e0c7b49c1051ec824e
SPDR DOUBLELINE EMERGING MARKETS FIXED INCOME ETF,EMTL,1516212,78470P309,BATS,False,ETF,,,,,,,,USD,Massachusetts; U.S.A,dc9293d55053b41aa7b1e58975606ceb
EMERGE EMPWR SUSTAINABLE GLOBAL CORE EQUITY ETF,EMZA,1914404,29102W303,BATS,True,ETF,,,,,,,,USD,New York; U.S.A,e884df484df8cc10f3f9d31c54d429ec
ISHARES MSCI NORWAY ETF,ENOR,1100663,46429B499,BATS,False,ETF,,,,,,,,USD,California; U.S.A,0f392a9f82a1568dc7ae08c8ef255874
EMLES ALPHA OPPORTUNITIES ETF,EOPS,1755351,291361863,BATS,True,ETF,,,,,,,,USD,Texas; U.S.A,b58015ac5be4824d7883b3d4d979d35f
INNOVATOR S&P INVESTMENT GRADE PREFERRED ETF,EPRF,1415726,45783G201 45783Y822 287711501,BATS,False,ETF,,,,,,,,USD,Illinois; U.S.A,7acd862790f042eaeaa6fdf0fd13118f
ISHARES EDGE MSCI MULTIFACTOR ENERGY ETF,ERGF,1100663,46435G599,BATS,True,ETF,,,,,,,,USD,,a7fe1c2dd958166054932c8aafaad6b2
XTRACKERS BLOOMBERG US INVESTMENT GRADE CORPORATE ESG ETF,ESCR,1503123,233051739,BATS,True,ETF,,,,,,,,USD,New York; U.S.A,6df2cde0f8e939269de91b597bee8699
XTRACKERS JP MORGAN ESG EMERGING MARKETS SOVEREIGN ETF,ESEB,1503123,233051713,BATS,True,ETF,,,,,,,,USD,New York; U.S.A,7f61ba22854e489b5f7657dc94f8baa6
FLEXSHARES STOXX US ESG SELECT INDEX FUND,ESG,1491978,33939L696,BATS,False,ETF,,,,,,,,USD,Illinois; U.S.A,5f48f92f0bf9cc794b91258e864bcc82
FLEXSHARES STOXX GLOBAL ESG SELECT INDEX FUND,ESGG,1491978,33939L688,BATS,False,ETF,,,,,,,,USD,Illinois; U.S.A,004f0e6c6a1b0423459813343849891d
VANGUARD ESG US STOCK ETF,ESGV,52848,921910733,BATS,False,ETF,,,,,,,,USD,Pennsylvania; U.S.A,a7857d6c2f6306e25f30c6083410939e
XTRACKERS JP MORGAN ESG USD HIGH YIELD CORPORATE BOND ETF,ESHY,1503123,233051747,BATS,True,ETF,,,,,,,,USD,New York; U.S.A,60f5e6f61c31fda99f950388a62f1d45
ISHARES ESG AWARE MSCI USA SMALL-CAP ETF,ESML,1100663,46435U663,BATS,False,ETF,,,,,,,,USD,California; U.S.A,14438b574b49526883ba5d0ede8d5eda
EUCLID CAPITAL GROWTH ETF,EUCG,1742912,886364751,BATS,True,ETF,,,,,,,,USD,New York; U.S.A,1b9db568e2365d3cf80252e2af5afcfb
PROSHARES MSCI EUROPE DIVIDEND GROWERS,EUDV,1174610,74347B540,BATS,False,ETF,,,,,,,,USD,Maryland; U.S.A,62a342067cb4dc233282815787874684
WISDOMTREE EUROPE MULTIFACTOR FUND,EUMF,1350487,97717X255,BATS,True,ETF,,,,,,,,USD,,85f343c897f212a4b86dad8d6417032d
XTRACKERS EUROZONE EQUITY ETF,EURZ,1503123,233051564,BATS,True,ETF,,,,,,,,USD,New York; U.S.A,1a0b8f395d3c738cf3c58a3b3dca3ac3
UBS VELOCITYSHARES 1X LONG VSTOXX FUTURES,EVIX,,90274E828,BATS,True,ETN,,,,,,,,USD,,a47c646275edf0edf01c9bc94ba7e0e8
ISHARES ESG AWARE MSCI USA VALUE ETF,EVUS,1100663,46436E221,BATS,False,ETF,,,,,,,,USD,California; U.S.A,ca342d780578b86cf3258d58e7076115
ISHARES MSCI CANADA SMALL-CAP ETF,EWCS,1100663,46429B473,BATS,True,ETF,,,,,,,,USD,,b19ef7497088983ff5a6f7ddb08c6334
ISHARES MSCI GERMANY SMALL-CAP ETF,EWGS,1100663,46429B465,BATS,True,ETF,,,,,,,,USD,California; U.S.A,5994f50d333db41cb93304b50ac82c84
ISHARES MSCI UNITED KINGDOM SMALL-CAP ETF,EWUS,1100663,46429B416,BATS,False,ETF,,,,,,,,USD,California; U.S.A,ada406d00d9ddfdfd3da5204973987f9
UBS VELOCITYSHARES 1X DAILY INVERSE VSTOX,EXIV,,90274E810,BATS,True,ETN,,,,,,,,USD,,bd3cc50d6fa02652bbcd89853f8bb453
CAMBRIA EMERGING SHAREHOLDER YIELD ETF,EYLD,1529390,132061706,BATS,False,ETF,,,,,,,,USD,California; U.S.A,00cc5fae602858476dbbf669988b6e3e
FRANKLIN TEMPLETON DIGITAL HOLDINGS TRUST,EZBC,1992870,354921108,BATS,False,ETF,,,6221,Finance Insurance And Real Estate,Commodity Contracts Brokers & Dealers,,,USD,California; U.S.A,d0ca1c33bc7dfd6445460b6cb7b989c6
ISHARES MSCI EUROZONE ETF,EZU,930667,464286608,BATS,False,ETF,,,,,,,,USD,California; U.S.A,cc074cd517c7e0954a366c7f3e7b80a6
CAMBRIA GLOBAL TAIL RISK ETF,FAIL,1529390,132061805,BATS,False,ETF,,,,,,,,USD,California; U.S.A,3d2fdb6ca1159e2c6df6766749dbd31c
PROSPORTS SPONSORS ETF,FANZ,1547950,30151E889,BATS,True,ETF,,,,,,,,USD,,4c126f056dc3a619903716d4b14098e4
FT VEST US EQUITY BUFFER ETF - APRIL,FAPR,1667919,33740U885,BATS,False,ETF,,,,,,,,USD,Illinois; U.S.A,c5db9a3e2dad410360c518a3e85e8674
FT VEST US EQUITY BUFFER ETF - AUGUST,FAUG,1667919,33740F862,BATS,False,ETF,,,,,,,,USD,Illinois; U.S.A,2224d437efa17b8f121701982e1dffce
FIDELITY BLUE CHIP GROWTH ETF,FBCG,945908,316092352,BATS,False,ETF,,,,,,,,USD,Massachusetts; U.S.A,000d89dcb4ea2001305ea3bf3d36370a
FIDELITY BLUE CHIP VALUE ETF,FBCV,945908,316092345,BATS,False,ETF,,,,,,,,USD,Massachusetts; U.S.A,d9f622c6aee90f4d931949ef12bdd8bd
FIDELITY WISE ORIGIN BITCOIN FUND,FBTC,1852317,315948109,BATS,False,ETF,,,6221,Finance Insurance And Real Estate,Commodity Contracts Brokers & Dealers,,,USD,Massachusetts; U.S.A,a6447ca2b4bfdc1eab2a7abee868a165
FIDELITY DYNAMIC BUFFERED EQUITY ETF,FBUF,1898391,31624J737,BATS,False,ETF,,,,,,,,USD,Massachusetts; U.S.A,9ad76ac4de461454978eae1f00af56b4
FIDELITY CLOUD COMPUTING ETF,FCLD,945908,316092246,BATS,False,ETF,,,,,,,,USD,Massachusetts; U.S.A,487262941f08fbd58007587d4196cc0c
FIDELITY STOCKS FOR INFLATION ETF,FCPI,945908,316092386,BATS,False,ETF,,,,,,,,USD,Massachusetts; U.S.A,161169e7e59819ca34dc75f4c4b8da2e
FIRST TRUST LUNT US FACTOR ROTATION ETF,FCTR,1329377,33733E872,BATS,False,ETF,,,,,,,,USD,Illinois; U.S.A,49e41440d923dc64034455f83a0bc899
FOUNDATIONS DYNAMIC CORE ETF,FDCE,1552947,90214Q550,BATS,False,ETF,,,,,,,,USD,Ohio; U.S.A,3f6973a02747f6006a0d5c4b09d95a3b
FT VEST US EQUITY BUFFER ETF - DECEMBER,FDEC,1667919,33740U505,BATS,False,ETF,,,,,,,,USD,Illinois; U.S.A,18cd11fa8312c4f57f4517f597eda56b
FIDELITY EMERGING MARKETS MULTIFACTOR ETF,FDEM,945908,316092543,BATS,False,ETF,,,,,,,,USD,Massachusetts; U.S.A,a4e2164350b32de42561d92a3d8d37ec
FIDELITY INTERNATIONAL MULTIFACTOR ETF,FDEV,945908,316092535,BATS,False,ETF,,,,,,,,USD,Massachusetts; U.S.A,fa664dc923ea73c554ffb8c9a2e940f9
FOUNDATIONS DYNAMIC GROWTH ETF,FDGR,1552947,90214Q543,BATS,False,ETF,,,,,,,,USD,Ohio; U.S.A,befeedc5610f8a3f82002b8022999f2a
FIDELITY DIGITAL HEALTH ETF,FDHT,945908,316092238,BATS,False,ETF,,,,,,,,USD,Massachusetts; U.S.A,de6e86c72cbed051f49e32019a27e03b
FT VEST DOW JONES INTERNET & TARGET INCOME ETF,FDND,1517936,33738D754,BATS,False,ETF,,,,,,,,USD,Illinois; U.S.A,be4e05587475a094f1227a0b3e22cf14
FIDELITY ELECTRIC VEHICLES AND FUTURE TRANSPORTATION ETF,FDRV,945908,316092220,BATS,False,ETF,,,,,,,,USD,Massachusetts; U.S.A,d2e80ae65e1be541d3b1897dd8c8f238
FOUNDATIONS DYNAMIC INCOME ETF,FDTB,1552947,90214Q527,BATS,False,ETF,,,,,,,,USD,Ohio; U.S.A,9b871638208c325984b1cd8e5091cd30
FOUNDATIONS DYNAMIC VALUE ETF,FDVL,1552947,90214Q535,BATS,False,ETF,,,,,,,,USD,Ohio; U.S.A,c778d13fc341383d42b7f0f3e82fd635
PGIM US LARGE-CAP BUFFER 12 ETF - FEBRUARY,FEBP,1992104,69420N304,BATS,False,ETF,,,,,,,,USD,New Jersey; U.S.A,4708639454065daaabc72a7bb1ca6381
TRUESHARES STRUCTURED OUTCOME (FEBRUARY) ETF,FEBZ,1683471,53656F755,BATS,False,ETF,,,,,,,,USD,Wisconsin; U.S.A,1be8cbb67e33808db1a0a1f4b6606639
EMLES FEDERAL CONTRACTORS ETF,FEDX,1755351,291361871,BATS,True,ETF,,,,,,,,USD,Texas; U.S.A,4d0c145f6f7632d13e029a1050f6163d
FT VEST US EQUITY BUFFER ETF - FEBRUARY,FFEB,1667919,33740F763,BATS,False,ETF,,,,,,,,USD,Illinois; U.S.A,0756bfc378ff1bc4fb4ed044f1768a99
FORMULA FOLIOS HEDGED GROWTH ETF,FFHG,1644419,66538H674,BATS,True,ETF,,,,,,,,USD,,d628fd926bf51a5506e668d66876cfe5
FIDELITY FUNDAMENTAL LARGE CAP CORE ETF,FFLC,945908,316092360,BATS,False,ETF,,,,,,,,USD,Massachusetts; U.S.A,aeed35c351dc50501150fc05fbe9079e
FIDELITY FUNDAMENTAL LARGE CAP GROWTH ETF,FFLG,945908,316092337,BATS,False,ETF,,,,,,,,USD,Massachusetts; U.S.A,fbe0335818510e2af6cef49012d55ce7
FIDELITY FUNDAMENTAL LARGE CAP VALUE ETF,FFLV,945908,31609A602,BATS,False,ETF,,,,,,,,USD,Massachusetts; U.S.A,eb4e23b9bdceb5cbec9aca425dd80f4e
FRANKLIN FOCUSED GROWTH ETF,FFOG,1655589,35473P421,BATS,False,ETF,,,,,,,,USD,California; U.S.A,36deb04bfdc3b95405d13070d6079e01
FORMULAFOLIOS SMART GROWTH ETF,FFSG,1644419,66538H567,BATS,True,ETF,,,,,,,,USD,,976e5f6f65536a30c6b415599fb5b6c5
FIDELITY FUNDAMENTAL SMALL-MID CAP ETF,FFSM,945908,316092295,BATS,False,ETF,,,,,,,,USD,Massachusetts; U.S.A,9ae05ad007f00e52e8edfb2569fe25ed
FORMULAFOLIOS TACTICAL GROWTH ETF,FFTG,1644419,66538H575,BATS,True,ETF,,,,,,,,USD,Ohio; U.S.A,14d862c5ae0380eb459476cfbd3796c3
FORMULAFOLIOS TACTICAL INCOME ETF,FFTI,1644419,66538H666,BATS,True,ETF,,,,,,,,USD,Ohio; U.S.A,c0039f409602827506b61224a4f8d64c
FIDELITY HEDGED EQUITY ETF,FHEQ,1898391,31624J745,BATS,False,ETF,,,,,,,,USD,Massachusetts; U.S.A,e8ed7b7e1bef8c21775b3a60350ac407
ISHARES US FIXED INCOME BALANCED RISK SYSTEMATIC ETF,FIBR,1100663,46435U796 46431W846,BATS,False,ETF,,,,,,,,USD,California; U.S.A,d61bcb1b620c28269f8fc835dfc9532f
FT VEST US EQUITY BUFFER ETF - JANUARY,FJAN,1667919,33740F623,BATS,False,ETF,,,,,,,,USD,Illinois; U.S.A,9fc782a2c753b966050b71f7fb79f06c
FT VEST US EQUITY BUFFER ETF - JULY,FJUL,1667919,33740U208,BATS,False,ETF,,,,,,,,USD,Illinois; U.S.A,03b43856b3a8d73d7b306c06974884f1
FT VEST US EQUITY BUFFER ETF - JUNE,FJUN,1667919,33740F722,BATS,False,ETF,,,,,,,,USD,Illinois; U.S.A,c2c0d06116aecd129b6c7b2a0d23f13d
IPATH US TREASURY FLATTENER ETN,FLAT,,06740L485,BATS,True,ETN,,,,,,,,USD,,2afef07d6c2d914834528f5bb410ad4d
FRANKLIN SENIOR LOAN ETF,FLBL,1655589,35473P595,BATS,False,ETF,,,,,,,,USD,California; U.S.A,86a067d656fc5d0f8a9c4d5cbc785ad3
FIDELITY LOW DURATION BOND FACTOR ETF,FLDR,1562565,316188408,BATS,False,ETF,,,,,,,,USD,Massachusetts; U.S.A,6ab3f75519c880319ea1d0d3e5669ffd
RIVERNORTH PATRIOT ETF,FLDZ,1683471,53656F227,BATS,False,ETF,,,,,,,,USD,Wisconsin; U.S.A,98a28585d2753e06eb426fed9832e581
FRANKLIN HIGH YIELD CORPORATE ETF,FLHY,1655589,35473P629,BATS,False,ETF,,,,,,,,USD,California; U.S.A,8fed482186ee1b3aeef874f3e98b4297
FRANKLIN INTERNATIONAL AGGREGATE BOND ETF,FLIA,1655589,35473P611,BATS,False,ETF,,,,,,,,USD,California; U.S.A,8f7f8bc1285bfd3fcb982c6148d7fe18
ISHARES FLOATING RATE BOND ETF,FLOT,1100663,46429B655,BATS,False,ETF,,,,,,,,USD,California; U.S.A,1ea3da85299779643a5b4330c46b900a
FRANKLIN LIBERTYQ US EQUITY,FLQL,,35473P801,BATS,False,ETF,,,,,,,,USD,,8e7ca74f99f0fb302713bb56601fadaa
FRANKLIN LIBERTYQ US MID CAP EQUITY,FLQM,,35473P884,BATS,False,ETF,,,,,,,,USD,,bfb05533d6b16a322ab53fdcabc6b7be
FRANKLIN US SMALL CAP MULTIFACTOR INDEX ETF,FLQS,1655589,35473P876,BATS,False,ETF,,,,,,,,USD,,b928e365547505130c70481c57aa7dfa
RAREVIEW INFLATION/DEFLATION ETF,FLTN,1719812,19423L532,BATS,True,ETF,,,,,,,,USD,Nevada; U.S.A,2204be990159fd2d20f3c5b159e61a1b
FIDELITY MAGELLAN ETF,FMAG,945908,316092329,BATS,False,ETF,,,,,,,,USD,Massachusetts; U.S.A,6696ead594f7fda10712353adff0c283
FT VEST US EQUITY BUFFER ETF - MARCH,FMAR,1667919,33740F599,BATS,False,ETF,,,,,,,,USD,Illinois; U.S.A,39b5e97a4d596c26fc60a82910cc5192
FT VEST US EQUITY BUFFER ETF - MAY,FMAY,1667919,33740F748,BATS,False,ETF,,,,,,,,USD,Illinois; U.S.A,637891c3459ccede979f43abaa0e56d9
ISHARES EDGE MSCI MULTIFACTOR FINANCIALS ETF,FNCF,1100663,46435G581,BATS,True,ETF,,,,,,,,USD,,7398482d11b90f88663a89f11c697bd3
FT VEST US EQUITY BUFFER ETF - NOVEMBER,FNOV,1667919,33740F847,BATS,False,ETF,,,,,,,,USD,Illinois; U.S.A,160a3b65527099340a17c3edc59c5e45
FT VEST US EQUITY BUFFER ETF - OCTOBER,FOCT,1667919,33740F664,BATS,False,ETF,,,,,,,,USD,Illinois; U.S.A,a35b3680099f159aeb5f495dbc4c7599
FOMO ETF,FOMO,1719812,19423L664 46144X636,BATS,True,ETF,,,,,,,,USD,Nevada; U.S.A,2ee026a37b7374fa99587a16b6b789bb
FPA GLOBAL EQUITY ETF,FPAG,1537140,66538R631,BATS,False,ETF,,,,,,,,USD,Ohio; U.S.A,fa32c967097f45dd6cb393ea227d9eec
FIDELITY PREFERRED SECURITIES & INCOME ETF,FPFD,945908,316092261,BATS,False,ETF,,,,,,,,USD,Massachusetts; U.S.A,10ab361fb17c1fffb89dcc7cb89a586b
FIDELITY REAL ESTATE INVESTMENT ETF,FPRO,945908,316092311,BATS,False,ETF,,,,,,,,USD,Massachusetts; U.S.A,ecb5ca6790fb8713778ac345685463cf
FREEDOM 100 EMERGING MARKETS ETF,FRDM,1592900,02072L607,BATS,False,ETF,,,,,,,,USD,Pennsylvania; U.S.A,0c31fc5875d82e34d61295c9454fc5b3
FIDELITY CLEAN ENERGY ETF,FRNW,945908,316092253,BATS,False,ETF,,,,,,,,USD,Massachusetts; U.S.A,c8b7d321d8b028429adc158a91cc83dd
FT VEST US EQUITY BUFFER ETF - SEPTEMBER,FSEP,1667919,33740U307,BATS,False,ETF,,,,,,,,USD,Illinois; U.S.A,b572662f03336acc27902ae99e5f9929
APTUS FORTIFIED VALUE ETF,FTVA,1540305,26922A610,BATS,True,ETF,,,,,,,,USD,,f2c9c1061fd49109cb138fceb840cf1b
CORNERCAP FUNDAMETRICS LARGE-CAP ETF,FUNL,1970751,89832P267 00777X660,BATS,False,ETF,,,,,,,,USD,Wisconsin; U.S.A,4ae4390cd3d126b05a499f0e5769336e
PROSHARES MANAGED FUTURES STRATEGY ETF,FUT,1174610,74347B532,BATS,True,ETF,,,,,,,,USD,Maryland; U.S.A,91d63d69958a6534b10374cf3ab2b4fd
FIDELITY YIELD ENHANCED EQUITY ETF,FYEE,1898391,31624J729,BATS,False,ETF,,,,,,,,USD,Massachusetts; U.S.A,3f093eca9505081618b7995715b8000b
CAMBRIA FOREIGN SHAREHOLDER YIELD ETF,FYLD,1529390,132061300,BATS,False,ETF,,,,,,,,USD,California; U.S.A,c087494639403202a85726546dab730f
CAMBRIA GLOBAL ASSET ALLOCATION ETF,GAA,1529390,132061607,BATS,False,ETF,,,,,,,,USD,California; U.S.A,3d40befdc520c0d125c058829b697570
FT VEST US EQUITY MODERATE BUFFER ETF - APRIL,GAPR,1667919,33740F458,BATS,False,ETF,,,,,,,,USD,Illinois; U.S.A,25986cf7d260629ac142f3e21ad1f97f
FT VEST US EQUITY MODERATE BUFFER ETF - AUGUST,GAUG,1667919,33740U653,BATS,False,ETF,,,,,,,,USD,Illinois; U.S.A,dfbdd595330a7092d05ce93f60feb346
GOLDMAN SACHS BLOOMBERG CLEAN ENERGY EQUITY ETF,GCLN,1479026,38149W754,BATS,False,ETF,,,,,,,,USD,New York; U.S.A,1e580e6fb1a073bbeb9fa56ecb472317
PACER GLOBAL CASH COWS DIVIDEND ETF,GCOW,1616668,69374H709,BATS,False,ETF,,,,,,,,USD,Pennsylvania; U.S.A,7cfae5fa882c817c9534b5ca01d8bd24
WISDOMTREE EFFICIENT GOLD PLUS EQUITY STRATEGY FUND,GDE,1350487,97717Y568,BATS,False,ETF,,,,,,,,USD,New York; U.S.A,71f56311fe404839c6f3a59958b44d58
FT VEST US EQUITY MODERATE BUFFER ETF - DECEMBER,GDEC,1667919,33740U679,BATS,False,ETF,,,,,,,,USD,Illinois; U.S.A,a52d13aa55bb439b4199fa583f73637f
GADSDEN DYNAMIC MULTI-ASSET ETF,GDMA,1592900,02072L870 26922A354,BATS,False,ETF,,,,,,,,USD,Wisconsin; U.S.A,7e47a43d2c1f3c8c7ca62891647181ad
WISDOMTREE EFFICIENT GOLD PLUS GOLD MINERS STRATEGY FUND,GDMN,1350487,97717Y550,BATS,False,ETF,,,,,,,,USD,New York; U.S.A,8b2d2a492ada80a66ad9cbb389f376d2
PRINCIPAL ACTIVE GLOBAL DIVIDEND INCOME ETF,GDVD1,1572661,74255Y706,BATS,True,ETF,,,,,,,,USD,Iowa; U.S.A,3d8874e698d4fa998da0147abcfd58e4
GOLDMAN SACHS ACCESS EMERGING MARKETS USD BOND ETF,GEMD,1479026,381430388,BATS,False,ETF,,,,,,,,USD,New York; U.S.A,204816b176d89751a21913f86d2aa65e
FT VEST US EQUITY MODERATE BUFFER ETF - FEBRUARY,GFEB,1667919,33740U737,BATS,False,ETF,,,,,,,,USD,Illinois; U.S.A,95d70f8d6b64ef4696171654b40cf7f7
GOOSE HOLLOW ENHANCED EQUITY ETF,GHEE,1719812,19423L482,BATS,False,ETF,,,,,,,,USD,Nevada; U.S.A,27e8e78337ef630d43242eb0ee9c3605
GOOSE HOLLOW MULTI-STRATEGY INCOME ETF,GHMS,1719812,19423L490,BATS,False,ETF,,,,,,,,USD,Nevada; U.S.A,226e8b136b0ff9ffad020a14961cef8a
GOOSE HOLLOW TACTICAL ALLOCATION ETF,GHTA,1719812,19423L573,BATS,False,ETF,,,,,,,,USD,Nevada; U.S.A,5ed1740444e155fa4d01aa99a4b0c08b
ISHARES US & INTL HIGH YIELD CORP BOND ETF,GHYG,930667,464286178,BATS,False,ETF,,,,,,,,USD,California; U.S.A,1554ab16f80ed378c858b64aeb4f369c
FT VEST US EQUITY MODERATE BUFFER ETF - JANUARY,GJAN,1667919,33740F516,BATS,False,ETF,,,,,,,,USD,Illinois; U.S.A,21b5bd4a5ff65a9ea35e4a60b33d6215
FT VEST US EQUITY MODERATE BUFFER ETF - JULY,GJUL,1667919,33740U661,BATS,False,ETF,,,,,,,,USD,Illinois; U.S.A,fc329bcf10a810e33feee9ba24e32d58
FT VEST US EQUITY MODERATE BUFFER ETF - JUNE,GJUN,1667919,33740F433,BATS,False,ETF,,,,,,,,USD,Illinois; U.S.A,bbdb96eb7a26fd8bb61b5aee76a0e0c9
GOLDMAN SACHS ACTIVEBETA(R) WORLD LOW VOL PLUS EQUITY ETF,GLOV,1479026,38149W739,BATS,False,ETF,,,,,,,,USD,New York; U.S.A,c750040e9721816e38e896476d2b547c
FT VEST US EQUITY MODERATE BUFFER ETF - MARCH,GMAR,1667919,33740F482,BATS,False,ETF,,,,,,,,USD,Illinois; U.S.A,6665ed0c61f6f329f2fe0e280ee6b663
FT VEST US EQUITY MODERATE BUFFER ETF - MAY,GMAY,1667919,33740F441,BATS,False,ETF,,,,,,,,USD,Illinois; U.S.A,96a9bdb318a4819ed9e3a6b9bbb33872
CAMBRIA GLOBAL MOMENTUM ETF,GMOM,1529390,132061508,BATS,False,ETF,,,,,,,,USD,California; U.S.A,ded3a24237de57cfd4446c396918deca
FT VEST US EQUITY MODERATE BUFFER ETF - NOVEMBER,GNOV,1667919,33740U687,BATS,False,ETF,,,,,,,,USD,Illinois; U.S.A,aada3615308f2ee7640cd14ec388ec18
FT VEST US EQUITY MODERATE BUFFER ETF - OCTOBER,GOCT,1667919,33740U695,BATS,False,ETF,,,,,,,,USD,Illinois; U.S.A,714b2cd736c1db01b88a03f771efdab8
STRATEGY SHARES GOLD-HEDGED BOND ETF,GOLY,1506213,86280R878,BATS,False,ETF,,,,,,,,USD,Indiana; U.S.A,cbc74afef1e70f276b51b61475842bc1
KURV YIELD PREMIUM GOOGLE (GOOGL) ETF,GOOP,1848758,78433H717,BATS,False,ETF,,,,,,,,USD,Connecticut; U.S.A,7f34f82f0171784b8ec954a95ce5b0d3
T-REX 2X LONG ALPHABET DAILY TARGET ETF,GOOX,1771146,26923N595,BATS,False,ETF,,,,,,,,USD,Virginia; U.S.A,5440bcdf2f1929cfb00f5ce88722cf21
REPUBLICAN POLICIES FUND,GOP,1683471,00509T102,BATS,True,ETF,,,,,,,,USD,,88adca8e22e00093f690ba8258d9c474
ISHARES US TREASURY BOND ETF,GOVT,1100663,46429B267,BATS,False,ETF,,,,,,,,USD,California; U.S.A,0841f366005f0580f0e57c370429bf4c
ISHARES 25+ YEAR TREASURY STRIPS BOND ETF,GOVZ,1100663,46436E577,BATS,False,ETF,,,,,,,,USD,California; U.S.A,1693195af1be4b07642baf38239d9fa5
GOLDMAN SACHS ACTIVEBETA(R) PARIS-ALIGNED CLIMATE US LARGE CAP EQUITY ETF,GPAL,1479026,38149W747,BATS,True,ETF,,,,,,,,USD,New York; U.S.A,352e1a436b60df769366d150ed64a7da
GOLDMAN SACHS NORTH AMERICAN PIPELINES & POWER EQUITY ETF,GPOW,1479026,38149W648,BATS,False,ETF,,,,,,,,USD,New York; U.S.A,251d85e77928806565a224d73dcf87a8
XTRACKERS GERMANY EQUITY ETF,GRMY,1503123,233051556,BATS,True,ETF,,,,,,,,USD,,6dfff703aeac1eae5c90aef46b598aa5
WISDOMTREE GLOBAL SMALLCAP DIVIDEND FUND,GSD2,1350487,97717X446,BATS,True,ETF,,,,,,,,USD,,4ac75e85ec24da1e2de7ea20fd957590
GOLDMAN SACHS MARKETBETA EMERGING MARKETS EQUITY ETF,GSEE,1479026,381430164,BATS,False,ETF,,,,,,,,USD,New York; U.S.A,c3478b16074fc9cb7692612b9dc1e34c
FT VEST US EQUITY MODERATE BUFFER ETF - SEPTEMBER,GSEP,1667919,33740U711,BATS,False,ETF,,,,,,,,USD,Illinois; U.S.A,75d1988994d9c0ff278886d87f93b790
GOLDMAN SACHS EQUAL WEIGHT US LARGE CAP EQUITY ETF,GSEW,1479026,381430438,BATS,False,ETF,,,,,,,,USD,,a4183ca6e29fc06127a3dea93d94472e
GOLDMAN SACHS MARKETBETA INTERNATIONAL EQUITY ETF,GSID,1479026,381430180,BATS,False,ETF,,,,,,,,USD,New York; U.S.A,17eb2088649320a9be20a8f7f9597eb6
GOLDMAN SACHS ACCESS ULTRA SHORT BOND ETF,GSST,1479026,381430230,BATS,False,ETF,,,,,,,,USD,New York; U.S.A,310b330452a9af532d552eb4f81d37cf
GOLDMAN SACHS MARKETBETA US EQUITY ETF,GSUS,1479026,381430123,BATS,False,ETF,,,,,,,,USD,New York; U.S.A,4ff9c7a8ed0cd74114d91394687c5aae
GOLDMAN SACHS ACCESS INFLATION PROTECTED USD BOND ETF,GTIP,1479026,381430362,BATS,False,ETF,,,,,,,,USD,New York; U.S.A,128902cc3bf6911fd2d0ec55ca81eacd
CAMBRIA GLOBAL VALUE ETF,GVAL,1529390,132061409,BATS,False,ETF,,,,,,,,USD,California; U.S.A,ee06a01001115d7a22043edb34861dc6
ISHARES INTERMEDIATE GOVERNMENT/CREDIT BOND ETF,GVI,1100663,464288612,BATS,False,ETF,,,,,,,,USD,California; U.S.A,cfa80ff12453db4ceddec36c7384c1dd
ISHARES EDGE MSCI MIN VOL GLOBAL CURRENCY HEDGED ETF,HACV,1100663,464289115,BATS,True,ETF,,,,,,,,USD,California; U.S.A,02f3a35631d7e8b400e46552acba8b2e
INNOVATOR PREMIUM INCOME 9 BUFFER ETF - APRIL,HAPR,1415726,45783Y327,BATS,False,ETF,,,,,,,,USD,Illinois; U.S.A,c920a6cde77d4aad8e1d5f6a311ba55f
RESIDENTIAL REIT ETF,HAUS,1742912,886364587,BATS,False,ETF,,,,,,,,USD,New York; U.S.A,1eb5966b87973c190c07e27fab64330e
